{
  "schema": "promptbranch.ask.reply",
  "schema_version": "1.0",
  "request_id": "req_20260510_repair_001",
  "correlation_id": "corr_20260510_repair_001",
  "status": "completed",
  "result_type": "repair_candidate",
  "summary": "Created repair candidate without advancing MVP scope.",
  "baseline": {
    "input_artifact": "chatgpt_claudecode_workflow_v0.0.207.zip",
    "input_version": "v0.0.207",
    "output_artifact": "chatgpt_claudecode_workflow_v0.0.207.1.zip",
    "output_version": "v0.0.207.1",
    "release_type": "repair",
    "base_release": "v0.0.207",
    "repair_reason": "validation failure in intended release; no scope advancement"
  },
  "changes": [
    {
      "path": "promptbranch_protocol/schemas/ask.request.schema.json",
      "kind": "added",
      "summary": "Defines the ask request envelope."
    }
  ],
  "artifacts": [
    {
      "kind": "zip",
      "filename": "chatgpt_claudecode_workflow_v0.0.207.1.zip",
      "version": "v0.0.207.1",
      "role": "repair_candidate",
      "download": {
        "available": true,
        "link_text": "chatgpt_claudecode_workflow_v0.0.207.1.zip",
        "url": null,
        "url_seen_at": "2026-05-10T00:00:00Z",
        "url_temporary": true,
        "requires_browser_context": false
      },
      "source": {
        "request_id": "req_20260510_repair_001",
        "answer_id": "ans_20260510_repair_001",
        "url_seen_at": "2026-05-10T00:00:00Z",
        "url_temporary": true
      }
    }
  ],
  "validation": {
    "claimed": [
      "bash -n shell scripts",
      "py_compile OK",
      "focused tests passed",
      "ZIP hygiene passed"
    ],
    "not_claimed": [
      "full browser suite",
      "local adoption"
    ]
  },
  "next_step": {
    "operator_action": "download_verify_test_adopt",
    "recommended_command": "pb artifact intake --from-last-answer --download --verify --migrate --json"
  },
  "confidence": "medium",
  "answer_id": "ans_20260510_repair_001"
}
